{
  "$schema": "https://json-schema.org/draft/2020-12/schema",
  "$id": "https://31andrews.local/schema/rounds.schema.json",
  "title": "Published kitchen rounds",
  "type": "object",
  "required": [
    "format",
    "current",
    "rounds"
  ],
  "properties": {
    "format": {
      "const": "31andrews.swipe_rounds/1"
    },
    "current": {
      "type": "string"
    },
    "answers_endpoint": {
      "type": "string"
    },
    "rounds": {
      "type": "array",
      "minItems": 1,
      "items": {
        "type": "object",
        "required": [
          "round",
          "deck",
          "title",
          "status",
          "published"
        ],
        "properties": {
          "round": {
            "type": "string"
          },
          "deck": {
            "type": "string"
          },
          "title": {
            "type": "string"
          },
          "session_size": {
            "type": "integer",
            "minimum": 1,
            "default": 20
          },
          "status": {
            "enum": [
              "open",
              "closed"
            ]
          },
          "published": {
            "type": "string",
            "format": "date-time"
          }
        },
        "additionalProperties": false
      }
    },
    "admin_key": {
      "type": "string"
    }
  },
  "additionalProperties": false
}
