{
  "format": "31andrews.swipe_rounds/1",
  "current": "R01",
  "answers_endpoint": "",
  "rounds": [
    {
      "round": "R01",
      "deck": "decks/R01/deck.json",
      "title": "Round 1: Your home, three looks and a few choices",
      "session_size": 19,
      "status": "open",
      "published": "2026-10-28T12:38:13.070Z"
    }
  ],
  "admin_key": "cape1941"
}
